E1: BODEN SHOOTOUT
B2: NAME | C2: FIRST 9 | D2: SECOND 9 | E2: TOTAL | F2: PLACE | G2: AMT
B3: CHAMPIONSHIP
A4: 1 | B4: Cameron Conant | C4: 31 | D4: 33 | E4: =C4+D4 -> 64 | F4: 1ST | G4: 108 | I4: PIN PRIZES
A5: 2 | B5: Doug Durr | C5: 33 | D5: 32 | E5: =C5+D5 -> 65 | F5: 2ND | G5: 81 | I5: #4 Closest to | K5: Josh Gill 58.5"
A6: 3 | B6: Randy Burch | C6: 33 | D6: 32 | E6: =C6+D6 -> 65 | F6: 3RD | G6: 54 | I6: #5 Longest Putt | K6: Bruce Durr 166"
A7: 4 | B7: Tom Glynn | C7: 33 | D7: 33 | E7: =C7+D7 -> 66 | F7: 4TH | G7: 27 | I7: #6 Closest to | K7: Gary Wolters 58"
A8: 5 | B8: Dave Carey | C8: 33 | D8: 34 | E8: =C8+D8 -> 67 | I8: #7 Longest Putt | K8: Todd Boxum 33' 3"
A9: 6 | B9: Hank Doering | C9: 35 | D9: 33 | E9: =C9+D9 -> 68 | I9: #9 Closest to | K9: Tom Glynn 36"
A10: 7 | B10: Gary Wolters | C10: 34 | D10: 35 | E10: =C10+D10 -> 69 | I10: #10 Longest Putt | K10: Lynn Zierlein 292"
A11: 8 | B11: Shane McCall | C11: 34 | D11: 35 | E11: =C11+D11 -> 69
A12: 9 | B12: Dan Glynn | C12: 36 | D12: 34 | E12: =C12+D12 -> 70
A13: 10 | B13: John Boden | C13: 36 | D13: 34 | E13: =C13+D13 -> 70
A14: 11 | B14: Lynn Zierlein | C14: 36 | D14: 34 | E14: =C14+D14 -> 70
A15: 12 | B15: Carl Vinsonhaler | C15: 37 | D15: 33 | E15: =C15+D15 -> 70
B16: FIRST FLIGHT
A17: 13 | B17: Troy Shirmer | C17: 36 | D17: 35 | E17: =C17+D17 -> 71 | F17: 1ST | G17: 108
A18: 14 | B18: Kevin Laumann | C18: 36 | D18: 35 | E18: =C18+D18 -> 71 | F18: 2ND | G18: 81
A19: 15 | B19: Mark McClain | C19: 35 | D19: 37 | E19: =C19+D19 -> 72 | F19: 3RD | G19: 54
A20: 16 | B20: Howard Garey | C20: 37 | D20: 35 | E20: =C20+D20 -> 72 | F20: 4TH | G20: 27
A21: 17 | B21: Tim Schurr | C21: 36 | D21: 36 | E21: =C21+D21 -> 72
A22: 18 | B22: Wayne Wahrman | C22: 36 | D22: 36 | E22: =C22+D22 -> 72
A23: 19 | B23: Rick Koster | C23: 36 | D23: 36 | E23: =C23+D23 -> 72
A24: 20 | B24: Jesse Jackson | C24: 37 | D24: 35 | E24: =C24+D24 -> 72
A25: 21 | B25: Mike Heiland | C25: 37 | D25: 35 | E25: =C25+D25 -> 72
A26: 22 | B26: Jared Wolters | C26: 38 | D26: 34 | E26: =C26+D26 -> 72
B27: SECOND FLIGHT
A28: 23 | B28: Rick Hileman | C28: 38 | D28: 35 | E28: =C28+D28 -> 73 | F28: 1ST | G28: 108
A29: 24 | B29: Dennis Pletcher | C29: 38 | D29: 35 | E29: =C29+D29 -> 73 | F29: 2ND | G29: 81
A30: 25 | B30: Doug Wilcoxson | C30: 37 | D30: 37 | E30: =C30+D30 -> 74 | F30: 3RD | G30: 54
A31: 26 | B31: Joey Bellerive | C31: 35 | D31: 40 | E31: =C31+D31 -> 75 | F31: 4TH | G31: 27
A32: 27 | B32: Todd Boxum | C32: 38 | D32: 39 | E32: =C32+D32 -> 77
A33: 28 | B33: Steven Weltmer | C33: 41 | D33: 36 | E33: =C33+D33 -> 77
A34: 29 | B34: Curtis Peterson | C34: 40 | D34: 38 | E34: =C34+D34 -> 78
A35: 30 | B35: Rick Bargman | C35: 40 | D35: 38 | E35: =C35+D35 -> 78
A36: 31 | B36: Brad Anderson | C36: 37 | D36: 41 | E36: =C36+D36 -> 78
A37: 32 | B37: Alvie Ratliff | C37: 38 | D37: 41 | E37: =C37+D37 -> 79
A38: 33 | B38: Bruce Seems | C38: 38 | D38: 41 | E38: =C38+D38 -> 79
A39: 34 | B39: Ferrill Conant | C39: 38 | D39: 41 | E39: =C39+D39 -> 79
A40: 35 | B40: Fletch Bolton | C40: 39 | D40: 40 | E40: =C40+D40 -> 79
B41: THIRD FLIGHT
A42: 36 | B42: Josh Gill | C42: 37 | D42: 43 | E42: =C42+D42 -> 80 | F42: 1ST | G42: 108
A43: 37 | B43: Anthony Peterson | C43: 39 | D43: 41 | E43: =C43+D43 -> 80 | F43: 2ND | G43: 81
A44: 38 | B44: Russ Nelson | C44: 43 | D44: 37 | E44: =C44+D44 -> 80 | F44: 3RD | G44: 54
A45: 39 | B45: Ross Barr | C45: 38 | D45: 44 | E45: =C45+D45 -> 82 | F45: 4TH | G45: 27
A46: 40 | B46: Cliff Kimble | C46: 42 | D46: 41 | E46: =C46+D46 -> 83
A47: 41 | B47: Bruce Durr | C47: 43 | D47: 42 | E47: =C47+D47 -> 85
A48: 42 | B48: Mica McCray | C48: 44 | D48: 43 | E48: =C48+D48 -> 87
A49: 43 | B49: Steve Peterson | C49: 44 | D49: 43 | E49: =C49+D49 -> 87
A50: 44 | B50: Kenton Weltmer | C50: 45 | D50: 44 | E50: =C50+D50 -> 89
A51: 45 | B51: Ray Nelson | C51: 44 | D51: 46 | E51: =C51+D51 -> 90
A52: 46
A53: 47
A54: 48
A55: 49
A56: 50
A57: 51
A58: 52
A59: 53
A60: 54
A61: 55
A62: 56
A63: 57
A64: 58